{
  "index_name": "3b01bcb8-0b14-4abf-b6f2-c1bfd384ba69",
  "title": "Real-time Air Quality Index from various locations",
  "desc": "Real-time Air Quality Index from various locations across India published by CPCB",
  "created": 1501234567,
  "updated": 1728136800,
  "created_date": "2017-07-28",
  "updated_date": "2026-10-05T12:00:00Z",
  "total": 35,
  "count": 35,
  "limit": 100,
  "offset": 0,
  "records": [
    {
      "id": "1",
      "country": "India",
      "state": "Tamil Nadu",
      "city": "Chennai",
      "station": "Alandur Bus Depot, Chennai - CPCB",
      "last_update": "05-10-2026 12:00:00",
      "latitude": "12.9972",
      "longitude": "80.2005",
      "pollutant_id": "PM2.5",
      "pollutant_min": "32.0",
      "pollutant_max": "88.0",
      "pollutant_avg": "54.2",
      "pollutant_unit": "ug/m3"
    },
    {
      "id": "2",
      "country": "India",
      "state": "Tamil Nadu",
      "city": "Chennai",
      "station": "Alandur Bus Depot, Chennai - CPCB",
      "last_update": "05-10-2026 12:00:00",
      "latitude": "12.9972",
      "longitude": "80.2005",
      "pollutant_id": "PM10",
      "pollutant_min": "58.0",
      "pollutant_max": "142.0",
      "pollutant_avg": "96.4",
      "pollutant_unit": "ug/m3"
    },
    {
      "id": "3",
      "country": "India",
      "state": "Tamil Nadu",
      "city": "Chennai",
      "station": "Alandur Bus Depot, Chennai - CPCB",
      "last_update": "05-10-2026 12:00:00",
      "latitude": "12.9972",
      "longitude": "80.2005",
      "pollutant_id": "NO2",
      "pollutant_min": "14.0",
      "pollutant_max": "38.0",
      "pollutant_avg": "24.6",
      "pollutant_unit": "ug/m3"
    },
    {
      "id": "4",
      "country": "India",
      "state": "Tamil Nadu",
      "city": "Chennai",
      "station": "Alandur Bus Depot, Chennai - CPCB",
      "last_update": "05-10-2026 12:00:00",
      "latitude": "12.9972",
      "longitude": "80.2005",
      "pollutant_id": "SO2",
      "pollutant_min": "6.0",
      "pollutant_max": "18.0",
      "pollutant_avg": "11.1",
      "pollutant_unit": "ug/m3"
    },
    {
      "id": "5",
      "country": "India",
      "state": "Tamil Nadu",
      "city": "Chennai",
      "station": "Alandur Bus Depot, Chennai - CPCB",
      "last_update": "05-10-2026 12:00:00",
      "latitude": "12.9972",
      "longitude": "80.2005",
      "pollutant_id": "CO",
      "pollutant_min": "0.4",
      "pollutant_max": "1.2",
      "pollutant_avg": "0.75",
      "pollutant_unit": "mg/m3"
    },
    {
      "id": "6",
      "country": "India",
      "state": "Tamil Nadu",
      "city": "Chennai",
      "station": "Manali, Chennai - CPCB",
      "last_update": "05-10-2026 12:00:00",
      "latitude": "13.1656",
      "longitude": "80.2588",
      "pollutant_id": "PM2.5",
      "pollutant_min": "28.0",
      "pollutant_max": "75.0",
      "pollutant_avg": "48.0",
      "pollutant_unit": "ug/m3"
    },
    {
      "id": "7",
      "country": "India",
      "state": "Tamil Nadu",
      "city": "Chennai",
      "station": "Manali, Chennai - CPCB",
      "last_update": "05-10-2026 12:00:00",
      "latitude": "13.1656",
      "longitude": "80.2588",
      "pollutant_id": "PM10",
      "pollutant_min": "52.0",
      "pollutant_max": "118.0",
      "pollutant_avg": "82.5",
      "pollutant_unit": "ug/m3"
    },
    {
      "id": "8",
      "country": "India",
      "state": "Tamil Nadu",
      "city": "Chennai",
      "station": "Manali, Chennai - CPCB",
      "last_update": "05-10-2026 12:00:00",
      "latitude": "13.1656",
      "longitude": "80.2588",
      "pollutant_id": "NO2",
      "pollutant_min": "18.0",
      "pollutant_max": "45.0",
      "pollutant_avg": "29.4",
      "pollutant_unit": "ug/m3"
    },
    {
      "id": "9",
      "country": "India",
      "state": "Tamil Nadu",
      "city": "Chennai",
      "station": "Manali, Chennai - CPCB",
      "last_update": "05-10-2026 12:00:00",
      "latitude": "13.1656",
      "longitude": "80.2588",
      "pollutant_id": "SO2",
      "pollutant_min": "10.0",
      "pollutant_max": "32.0",
      "pollutant_avg": "19.8",
      "pollutant_unit": "ug/m3"
    },
    {
      "id": "10",
      "country": "India",
      "state": "Tamil Nadu",
      "city": "Chennai",
      "station": "Velachery Res. Area, Chennai - CPCB",
      "last_update": "05-10-2026 12:00:00",
      "latitude": "12.9786",
      "longitude": "80.2185",
      "pollutant_id": "PM2.5",
      "pollutant_min": "22.0",
      "pollutant_max": "62.0",
      "pollutant_avg": "38.5",
      "pollutant_unit": "ug/m3"
    },
    {
      "id": "11",
      "country": "India",
      "state": "Tamil Nadu",
      "city": "Chennai",
      "station": "Velachery Res. Area, Chennai - CPCB",
      "last_update": "05-10-2026 12:00:00",
      "latitude": "12.9786",
      "longitude": "80.2185",
      "pollutant_id": "PM10",
      "pollutant_min": "44.0",
      "pollutant_max": "98.0",
      "pollutant_avg": "68.2",
      "pollutant_unit": "ug/m3"
    },
    {
      "id": "12",
      "country": "India",
      "state": "Tamil Nadu",
      "city": "Chennai",
      "station": "Velachery Res. Area, Chennai - CPCB",
      "last_update": "05-10-2026 12:00:00",
      "latitude": "12.9786",
      "longitude": "80.2185",
      "pollutant_id": "NO2",
      "pollutant_min": "12.0",
      "pollutant_max": "31.0",
      "pollutant_avg": "20.1",
      "pollutant_unit": "ug/m3"
    }
  ]
}
